{
  "schema_version": "1.0.0",
  "benchmark_id": "example-contract-only-20260804",
  "created_at": "2026-08-04T09:00:00Z",
  "sensor": {
    "id": "tracker.spot-centroid",
    "version": "0.1.0",
    "commit": "0000000000000000000000000000000000000000"
  },
  "dataset": {
    "id": "synthetic-contract-example",
    "version": "0.1.0",
    "manifest_sha256": "bbbbbbbbbbbbbbbbbbbbbbbbbbbbbbbbbbbbbbbbbbbbbbbbbbbbbbbbbbbbbbbb"
  },
  "environment": {
    "purpose": "Schema example only; not an algorithm accuracy result"
  },
  "protocol": {
    "level": "L0",
    "name": "contract-validation",
    "repetitions": 1
  },
  "sample_counts": {
    "total": 1,
    "ok": 1,
    "degraded": 0,
    "lost": 0,
    "error": 0
  },
  "metrics": [
    {"name": "schema_valid_rate", "value": 1.0, "unit": "1", "threshold": 1.0, "passed": true}
  ],
  "status": "informational",
  "notes": ["This file demonstrates the result format and is not evidence of sensor accuracy."]
}
